platformLink,uni,title,degType,campus,duration,tuition,about,uniRank,languages,ects,city,country,toefl,ielts,gmat,gre,origLink,applyBy,startDate,disciplines,tuitiontype
https://www.mastersportal.com/studies/263698/,"Hanze University of Applied Sciences, Groningen",Data Science for Life Sciences ,M.Sc.,On Campus,1½ years,"2,168","The Data Science for Life Sciences master’s programme, offered by Hanze Hanze University of Applied Sciences, Groningen, is for life science or IT students who want to learn how they can be part of the growing field of data science.  ",.,English,90 ECTS,Groningen,Netherlands,     90      ,     6.5      ,.,.,https://sl.prtl.co/track/click/?target=https%3A%2F%2Fwww.hanzegroningen.eu%2Fdsls&facts=eyJsIjp7InQiOiJzdHVkeSIsImkiOiIyNjM2OTgiLCJkIjoiRGF0YSBTY2llbmNlIGZvciBMaWZlIFNjaWVuY2VzIiwibCI6InByZW1pdW0ifSwicyI6bnVsbCwidSI6eyJpIjoiMTcyLjMwLjkuMjAxIiwicyI6IjNjM2NjYzI1LTcyMjQtNDYwNS1iMTExLTc1M2I4MGNhZDEyNCIsImwiOiJlbi1HQiIsImMiOiJkZSJ9LCJmIjpbeyJhIjoiY2xpYyIsInQiOiJsaW5rIiwiaSI6IjIxMTcyNjAiLCJkIjoiaHR0cHM6Ly93d3cuaGFuemVncm9uaW5nZW4uZXUvZHNscyIsImwiOiJyZXZlbnVlIiwiZXgiOnsicHQiOiJsIn19XX0%3D&taps=null&duid=e55cd056-5f36-4a1a-8b39-939e6b41a41f&sid=9321501e-cc39-4486-9593-a1d625961e53,15/08/2021,01/09/2021,"Informatics & Information Sciences, Health Sciences, Data Science & Big Data","[""year""]"
https://www.mastersportal.com/studies/19817/,Karlsruhe Institute of Technology (KIT),Information Systems Engineering and Management,M.Sc.,On Campus,"1 year, 3 months","15,000","In this Information Systems Engineering and Management program offered by Karlsruhe Institute of Technology (KIT),  IT specialists and computer scientists as well as business administrators and engineers will be enabled to advance internal and external digitalization and to assume leadership functions, especially in the field of digital transformation of companies.",131st ,English,90 ECTS,Karlsruhe,Germany,     90      ,     6.5      ,.,.,.,.,05/10/2021,"Industrial & Systems Engineering, Management, Organisation & Leadership, Data Science & Big Data","[""year""]"
https://www.mastersportal.com/studies/262458/,Northeastern University,Enterprise Intelligence ,Master,On Campus,2 years,"16,674","The MPS in Enterprise Intelligence program at Northeastern University prepares you to excel in the fast-growing and dynamic fields of machine learning and artificial intelligence, while focusing on data, technology, and human literacy.",201st ,English,38 alternative credits,Boston,.,.,     6.5      ,.,.,https://sl.prtl.co/track/click/?target=https%3A%2F%2Fpages.northeastern.edu%2FEMINTGRADNETALYMPSEIAFF2020-03-01STUDYPORTALS_LPFA.html%3Futm_medium%3Daffiliate%26utm_source%3Dstudyportals%26utm_campaign%3Dem-glo-comp-net-all-def-aff-2019_12_01-studyportals&facts=eyJsIjp7InQiOiJzdHVkeSIsImkiOiIyNjI0NTgiLCJkIjoiRW50ZXJwcmlzZSBJbnRlbGxpZ2VuY2UiLCJsIjoicHJlbWl1bSJ9LCJzIjpudWxsLCJ1Ijp7ImkiOiIxNzIuMzAuOS4yMDEiLCJzIjoiM2MzY2NjMjUtNzIyNC00NjA1LWIxMTEtNzUzYjgwY2FkMTI0IiwibCI6ImVuLUdCIiwiYyI6ImRlIn0sImYiOlt7ImEiOiJjbGljIiwidCI6ImxpbmsiLCJpIjoiMjExNTgyOSIsImQiOiJodHRwczovL3BhZ2VzLm5vcnRoZWFzdGVybi5lZHUvRU1JTlRHUkFETkVUQUxZTVBTRUlBRkYyMDIwLTAzLTAxU1RVRFlQT1JUQUxTX0xQRkEuaHRtbD91dG1fbWVkaXVtPWFmZmlsaWF0ZSZ1dG1fc291cmNlPXN0dWR5cG9ydGFscyZ1dG1fY2FtcGFpZ249ZW0tZ2xvLWNvbXAtbmV0LWFsbC1kZWYtYWZmLTIwMTlfMTJfMDEtc3R1ZHlwb3J0YWxzIiwibCI6InJldmVudWUiLCJleCI6eyJwdCI6InNsIn19XX0%3D&taps=null&duid=e55cd056-5f36-4a1a-8b39-939e6b41a41f&sid=9321501e-cc39-4486-9593-a1d625961e53,13/07/2021,14/09/2021,"General Engineering & Technology, Data Science & Big Data, Artificial Intelligence","[""year ""]"
https://www.mastersportal.com/studies/305226/,ENEB Business School,Big Data and Business Intelligence,Master,On Campus,1½ years,"7,600","The Big Data and Business Intelligence program at ENEB Business School provides students and professionals with these abilities and knowledge, thus boosting their careers and exponentially increasing their chances to get a job or be promoted.",.,English,60 ECTS,Barcelona,Spain,.,.,.,.,.,.,.,"Business Administration, Business Intelligence & Analytics, Data Science & Big Data","[""year""]"
https://www.mastersportal.com/studies/279106/,Saint Louis University,Graduate Pathway in Health Data Science - Health Data Science,Pre-Master,On Campus,½ year,.,An INTO SLU Graduate Pathway in Health Data Science - Health Data Science will prepare you to enter your next semester of a master’s degree program at Saint Louis University. ,401st ,English,3 alternative credits,Saint Louis,.,     70      ,     6      ,.,.,.,.,19/08/2021,"Health Sciences, Data Science & Big Data, Health Informatics",.
https://www.mastersportal.com/studies/64573/,Santa Clara University,Business Analytics,M.B.A.,On Campus,"1 year, 4 months","1,078",Do you want a data-driven advantage? Analytics.Big data. The Internet of everything. The ability to collect and make sense of a vast amount of data has transformed industry—and you can be part of the transformation with our MS in Business Analytics program at Santa Clara University. ,.,English,48 alternative credits,Santa Clara,.,     90      ,     6.5      ,.,.,.,01/06/2021,21/09/2021,"Master in Business Administration (MBA), Data Science & Big Data","[""credit ""]"
https://www.mastersportal.com/studies/249152/,Copenhagen Business School (CBS),Data Science,M.Sc.,On Campus,2 years,Free,This Data Science programme from Copenhagen Business School (CBS) uniquely combines hard analytical skills with an understanding of the relevant business data context for application.,201st ,English,120 ECTS,Beijing,China,     94      ,     7      ,.,.,.,01/03/2021,01/09/2021,Data Science & Big Data,.
https://www.mastersportal.com/studies/271269/,Brunel University London,Statistics with Data Analytics,M.Sc.,On Campus,1 year,"12,083",The Statistics with Data Analytics course offered by Brunel University London is designed to train the next generation of statisticians with a focus on the field of data analytics. Employers expect skills in both statistics and computing.,351st ,English,180 alternative credits,London,.,     92      ,     6.5      ,.,.,.,20/08/2021,13/09/2021,"Statistics, Business Intelligence & Analytics, Data Science & Big Data","[""year ""]"
https://www.mastersportal.com/studies/257166/,Johns Hopkins University,Data Science,M.Sc.,Online,5 years,"3,775",The Data Science program from Johns Hopkins University balances theory and applications so that you can advance your career long-term.,12nd ,English,30 alternative credits,Baltimore,.,     100      ,     7      ,.,.,.,.,31/08/2021,Data Science & Big Data,"[""credit ""]"
https://www.mastersportal.com/studies/14503/,Sorbonne University,Data Mining and Knowledge Management,Master,On Campus,2 years,"4,000","Data Mining and Knowledge Management offered by Sorbonne University has become essential for improving the competitiveness of businesses and increasing access to knowledge. DMKM still, however, comes up against major scientific and technological obstacles. This EMMC’s degree in DMKM proposes specialist training in this field.",39th ,English,120 ECTS,Paris,France,     80      ,     6      ,.,.,.,.,.,Data Science & Big Data,"[""year""]"
https://www.mastersportal.com/studies/277955/,University of Wroclaw,Data Science,Master,On Campus,2 years,Free,"The Data Science program at the University of Wroclaw is a unique combination of solid mathematical background and computer science applications. Not only will you learn how to use tools, such as deep neural networks, but you will gain profound understanding why they work.",801st ,English,On Campus,Wroclaw,Poland,     72      ,     6      ,.,.,.,02/07/2021,02/10/2021,Data Science & Big Data,.
https://www.mastersportal.com/studies/227444/,The Chinese University of Hong Kong,Data Science and Business Statistics,M.Sc.,On Campus,2 years,"8,051",The Data Science and Business Statistics programme at The Chinese University of Hong Kong is organised by the Department of Statistics at the Chinese University of Hong Kong. It focuses on data analysis skills and explores core areas of applied and business statistics. This is a part-time taught programme that is based primarily on coursework.,43rd ,English,On Campus,Hong Kong,Hong Kong (SAR),     79      ,     6.5      ,.,.,.,28/02/2021,07/09/2021,Data Science & Big Data,"[""year ""]"
https://www.mastersportal.com/studies/222821/,Jheronimus Academy of Data Science (JADS),Data Science and Entrepreneurship,Pre-Master,On Campus,½ year,"2,143",​In preparation of the Master's program Data Science and Entrepreneurship at the Jheronimus Academy of Data Science (JADS) we offer several Pre-Master's programs at different levels - both Academic University and University of Applied Science / Hogeschool. ,.,English,30 ECTS,'s-Hertogenbosch,Netherlands,.,.,.,.,.,01/12/2021,01/02/2022,"Entrepreneurship, Data Science & Big Data","[""year ""]"
https://www.mastersportal.com/studies/130622/,Arizona State University,Computer Science - Big Data Systems,Master,On Campus,1 year,"19,339","The goal of this Computer Science - Big Data Systems program from Arizona State University is to provide students the knowledge, skills and the advanced research expertise in designing scalable (parallel, distributed, and real-time) systems for acquiring, storing, processing, and accessing large-scale heterogeneous multi-source data and in using analytical tools to mine information from the data. ",101st ,English,30 alternative credits,Tempe Junction,.,     80      ,     6.5      ,.,   Required   ,.,01/08/2021,13/01/2022,"Computer Sciences, Data Science & Big Data","[""year ""]"
https://www.mastersportal.com/studies/230610/,University of New England,Data Science,M.Sc.,On Campus,1 year,.,The Master of Data Science offered at University of New England will provide students with the required knowledge and practical skills to analyse and manage data. They will learn how to deal with large and diverse data sets and apply a variety of technologies to extract meaning from them.,501st ,English,96 alternative credits,Armidale,.,     79      ,     6      ,.,.,.,31/05/2021,28/06/2021,Data Science & Big Data,.
https://www.mastersportal.com/studies/193949/,Kazan Federal University,Geology (Complex Data Analysis in Petroleum Geology),M.Sc.,On Campus,2 years,"3,722","The Geology (Complex Data Analysis in Petroleum Geology) program at the Kazan Federal University aim is to give strong basics of geology, geophysics and its interpretation and the geological and dynamic modelling.",370th ,English,120 ECTS,Kazan,Russia,.,     6.5      ,.,.,.,01/06/2021,15/08/2021,"Geology, Mining, Oil & Gas, Data Science & Big Data","[""year ""]"
https://www.mastersportal.com/studies/267212/,International Business School,Data-Driven Management,M.Sc.,On Campus,1 year,"12,400",The unique Data-Driven Management programme of the International Business School is a transformational experience which aims to develop essential professional and soft skills to nurture leaders of the 21st century.,.,English,60 ECTS,Budapest,Hungary,.,     6.5      ,.,.,.,31/05/2021,01/09/2021,"Project Management, Management, Organisation & Leadership, Data Science & Big Data","[""year""]"
https://www.mastersportal.com/studies/189001/,Leiden University,Data Science: Computer Science,M.Sc.,On Campus,2 years,"2,168","The Data Science: Computer Science master's specialisation at Leiden University equips you with state-of-the-art knowledge in the advanced statistical techniques, machine learning and algorithmic aspects of data analysis.",70th ,English,120 ECTS,Leiden,Netherlands,     90      ,     6.5      ,.,.,.,15/06/2021,01/09/2021,"Computer Sciences, Data Science & Big Data","[""year""]"
https://www.mastersportal.com/studies/99353/,Kent State University,Digital Sciences,M.Sc.,On Campus,1 year,"18,031","The Master of Digital Sciences degree in Digital Sciences from the Kent State University  is designed to augment a student's skill set, opening the door to new career opportunities for students from diverse undergraduate backgrounds. ",501st ,English,32 alternative credits,Kent,.,     79      ,     6.5      ,.,   Required   ,.,.,27/08/2021,Data Science & Big Data,"[""year ""]"
https://www.mastersportal.com/studies/284097/,Temple University,Statistics and Data Science,M.Sc.,On Campus,1 year,915,Hone the predictive analytics skills needed to join the next generation of elite data analysts with the Master of Science in Statistics and Data Science in Temple University’s Fox School of Business.,301st ,English,30 alternative credits,Philadelphia,.,     79      ,     6.5      ,   Required   ,   Required   ,.,01/03/2021,23/08/2021,"Statistics, Data Science & Big Data, Actuarial Science","[""credit ""]"
https://www.mastersportal.com/studies/272215/,University of New South Wales,Master of Analytics,Master,Online,2 years,"16,848",Master of Analytics from University of New South Wales is one of the most comprehensive postgraduate qualifications in analytics offered 100% online and accelerated so you can graduate in only two years without compromising your career.,44th ,English,72 alternative credits,"Paddington, Sydney, NSW",.,     94      ,     7      ,.,.,.,.,.,"Business Intelligence & Analytics, International Business, Data Science & Big Data","[""year ""]"
https://www.mastersportal.com/studies/272217/,University of New South Wales,Master of Data Science,Master,Online,2 years,"16,202","Delivered 100% online, the Master of Data Science from University of New South Wales explores more ways to organise, identify, analyse and ultimately use data to inform strategies, redefine ambiguous questions and find answers that make a genuine impact.",44th ,English,72 alternative credits,"Paddington, Sydney, NSW",.,     90      ,     6.5      ,.,.,.,.,.,Data Science & Big Data,"[""year ""]"
https://www.mastersportal.com/studies/277791/,"University of the Witwatersrand, Johannesburg",e-Science,Master,On Campus,1½ years,"1,923","The Masters of Science by coursework and research report in the field of e-Science (MSc) from the University of the Witwatersrand, Johannesburg is completed over 18 months. It aims to train postgraduate students in computational, mathematical and statistical methods to solve data-driven problems.",201st ,English,On Campus,Johannesburg,South Africa,.,     7      ,.,.,.,31/10/2021,01/02/2022,"Physics, Computer Sciences, Data Science & Big Data","[""year ""]"
https://www.mastersportal.com/studies/165491/,Queen Mary University of London,Internet of Things,M.Sc.,On Campus,1 year,"12,249",Internet of Things programme offered at Queen Mary University of London will help you adapt to become one of the highly skilled and in-demand engineers who are able to fully exploit the potential that these technologies offer.,110th ,English,180 alternative credits,London,.,     79      ,     6      ,.,.,.,07/09/2021,21/09/2021,"Informatics & Information Sciences, Data Science & Big Data, Human Computer Interaction","[""year""]"
https://www.mastersportal.com/studies/270475/,University of Côte d'Azur,Mathematical Sciences for Biomedical Data and Biophysics,M.Sc.,On Campus,2 years,"4,000","This Mathematical Sciences for Biomedical Data and Biophysics programme offered by Université Côte d'Azur will provide prospective individuals with the opportunity to learn how to precisely understand a biological question, conceptualize biological phenomena with a mathematical model integrating observational data and find an appropriate way to solve it.",301st ,English,120 ECTS,Sophia Antipolis,France,.,.,.,.,.,30/06/2021,09/09/2021,"Bio & Biomedical Engineering, Data Science & Big Data, Health Informatics","[""year""]"
https://www.mastersportal.com/studies/262571/,University of Missouri - Columbia,Data Science and Analytics with Emphasis in Strategic Communications and Data Journalism,M.Sc.,On Campus,1 year,"19,970","Data Science and Analytics with Emphasis in Strategic Communications and Data Journalism from University of Missouri - Columbia is a 34-credit, online and mixed mode delivery, multidisciplinary program. ",151st ,English,34 alternative credits,Columbia,.,     80      ,     6.5      ,.,.,.,15/07/2021,24/08/2021,"Data Science & Big Data, Journalism, Digital Communication","[""year ""]"
https://www.mastersportal.com/studies/264945/,Cork Institute of Technology,Data Science and Analytics,M.Sc.,On Campus,1½ years,"6,500","This Data Science and Analytics course at Cork Institute of Technology has been designed to address the skills shortage in Data Science and Analytics, by equipping graduates with the scientific, technological, business and interpersonal skills necessary to operate professionally in this rapidly evolving interdisciplinary field",.,English,90 ECTS,Cork,Ireland,     80      ,     6      ,.,.,.,14/08/2021,01/09/2021,Data Science & Big Data,"[""year""]"
https://www.mastersportal.com/studies/40666/,Jean Monnet University,Machine Learning and Data Mining,M.Sc.,On Campus,2 years,750,Machine Learning and Data Mining is an international master program of University Jean Monnet (Saint-Étienne) and the Ecole des Mines de Saint-Etienne. It leads to the award of the French national master degre in Computer Science as well as the University Diploma in Machine Learning and Data Mining of the University Jean Monnet.,875th ,English,120 ECTS,Saint-Étienne,France,     82      ,     6.5      ,.,.,.,30/06/2021,31/08/2021,"Computer Sciences, Data Science & Big Data, Machine Learning","[""year""]"
https://www.mastersportal.com/studies/137469/,University of Ljubljana,Social Informatics,M.A.,On Campus,1 year,Free,"The transdisciplinary master’s study programme of Social Informatics at University of Ljubljana with more than 30 years long tradition brings together social and computer sciences for two reasons: firstly, to promote uses of various information-communication technologies (ICTs) in social science research.",501st ,English,60 ECTS,Ljubljana,Slovenia,.,.,.,.,.,09/05/2021,01/10/2021,"Sociology, Educational Research, Data Science & Big Data",.
https://www.mastersportal.com/studies/181248/,University of Minnesota,Bioinformatics and Computational Biology,M.Sc.,On Campus,1 year,"21,264",The objective of the Bioinformatics and Computational Biology program at University of Minnesota is to establish world-class academic and research programs at the University of Minnesota Rochester.,85th ,English,30 alternative credits,Minneapolis,.,     79      ,     6.5      ,.,.,.,.,08/09/2021,"Biology, Data Science & Big Data, Bioinformatics","[""year ""]"
https://www.mastersportal.com/studies/165537/,TED University,Applied Data Science,M.Sc.,On Campus,2 years,.,"Applied Data Science from TED University aims to extend the application range of statistics, has become one of the most needed professional branches of the century in recent years.",.,English,120 ECTS,Ankara,Turkey,     79      ,.,.,   Required   ,.,04/09/2021,05/10/2021,"Computer Sciences, Data Science & Big Data",.
https://www.mastersportal.com/studies/262570/,University of Missouri - Columbia,Data Science and Analytics with Emphasis in High Performance Computing,M.Sc.,On Campus,1 year,"19,975","Data Science and Analytics with Emphasis in High Performance Computing from University of Missouri - Columbia is a 34-credit, online and mixed mode delivery, multidisciplinary program. ",151st ,English,34 alternative credits,Columbia,.,     80      ,     6.5      ,.,.,.,15/07/2021,24/08/2021,"Computer Sciences, Data Science & Big Data","[""year ""]"
https://www.mastersportal.com/studies/160037/,Birmingham City University,Advanced Computer Science,M.Sc.,On Campus,1 year,"8,316","The MSc Advanced Computer Science programme intends to develop your competence in using tools and techniques for producing computer systems solutions, from a sound mathematical and scientific base while appreciating the professional responsibilities and quality needed by industry. The Advanced Computer Science - MSc is provided by Birmingham City University.",601st ,English,180 alternative credits,Birmingham,.,.,.,.,.,.,.,25/01/2021,"Computer Sciences, Data Science & Big Data","[""year""]"
https://www.mastersportal.com/studies/302866/,"Essex, University of",Data Science and its Applications,M.Sc.,On Campus,1 year,.,"Our MSc Data Science and its Applications is a conversion course specifically designed for students wanting to be part of our fast-growing digital economy but do not have the sufficient programming and statistics skills. This course you will place you at the core of data science with the application of theory and methods to real-world problems, specifically to use and exploit big data.",301st ,English,On Campus,Colchester,.,.,.,.,.,.,27/08/2021,03/10/2021,"Applied Mathematics, Data Science & Big Data",.
https://www.mastersportal.com/studies/276766/,Bournemouth University,Management with Business Analytics,M.Sc.,On Campus,1 year,"10,676","This conversion Management with Business Analytics course from Bournemouth University is delivered by the Business School, which has AACSB accreditation in recognition of our focus on excellence in all areas. It’s something that fewer than 5% of business schools worldwide have achieved, so you can be sure you’re in good hands.",401st ,English,180 alternative credits,Bournemouth,.,     60      ,     6      ,.,.,.,.,20/09/2021,"Management, Organisation & Leadership, Business Intelligence & Analytics, Data Science & Big Data","[""year ""]"
https://www.mastersportal.com/studies/277711/,The University of Exeter,Data Science,M.Sc.,On Campus,1 year,"11,182",MSc Data Science at The University of Exeter is a full-time Masters course for those interested in learning the underpinning theory of Data Science together with methods for implementation and application.,151st ,English,180 alternative credits,Exeter,.,     90      ,     6.5      ,.,.,.,.,20/09/2021,"Computer Sciences, Data Science & Big Data","[""year ""]"
https://www.mastersportal.com/studies/302864/,"Essex, University of",Applied Data Science,M.Sc.,On Campus,1 year,.,"Our MSc Applied Data Science is a conversion course which will build upon your undergraduate degree in the humanities, social or life sciences, giving you postgraduate-level skills in essential data science methods with various applications, covering case studies and applications of AI and data using a balance of methods and practical application.",301st ,English,On Campus,Colchester,.,.,.,.,.,.,27/08/2021,03/10/2021,"Applied Mathematics, Data Science & Big Data",.
https://www.mastersportal.com/studies/237734/,Royal Holloway University of London,Data Science and Analytics,M.Sc.,On Campus,1 year,"13,036","Study the Data Science and Analytics programme at Royal Holloway University of London and you’ll develop the practical skills needed to handle and analyse data in a wide variety of fields, preparing you for a rewarding career in Big Data. ",301st ,English,180 alternative credits,London,.,.,     6.5      ,.,.,.,.,21/09/2021,Data Science & Big Data,"[""year""]"
https://www.mastersportal.com/studies/99446/,Purdue University Global,Information Technology,M.Sc.,Online,2 years,345,"Information Technology from Purdue University Global helps working professionals make the connection between IT, communications, and business to develop marketable technical, creative, and managerial skills.",.,English,60 alternative credits,Augusta,.,     80      ,     6.5      ,.,.,.,.,24/03/2021,"Informatics & Information Sciences, Computer Sciences, Data Science & Big Data","[""credit ""]"
https://www.mastersportal.com/studies/6877/,University of Westminster,Big Data Technologies,M.Sc.,On Campus,1 year,"10,676","The Big Data Technologies degree offered at the University of Westminster addresses technologies, advanced theories and techniques, along with their application, implementation and integration with legacy systems.",651st ,English,180 alternative credits,London,.,     88      ,     6.5      ,.,.,.,01/08/2021,21/09/2021,"Data Science & Big Data, Web Technologies & Cloud Computing","[""year""]"
https://www.mastersportal.com/studies/191132/,University of Amsterdam,Psychology - Behavioural Data Science,M.Sc.,On Campus,1 year,"2,143","Understanding data about human behaviour is an important and valuable skill in today's society. Companies, public institutions and governmental organizations — they all use the continuous stream of big data to describe and predict human behaviour. This Psychology - Behavioural Data Science is taught at University of Amsterdam.",61st ,English,60 ECTS,Amsterdam,Netherlands,     100      ,     7      ,.,.,.,01/03/2021,03/09/2021,"Psychology, Organisational Behaviour, Data Science & Big Data","[""year""]"
https://www.mastersportal.com/studies/217037/,Western Sydney University,Digital Humanities,Master,On Campus,1½ years,"19,853",The Digital Humanities program at Western Sydney University is an emerging field of inter-disciplinary study. It involves the application of digital techniques and computational analysis to the sorts of research questions traditionally asked by scholars in the humanities disciplines.,251st ,English,120 alternative credits,Paramatta,.,     105      ,     7.5      ,.,.,.,15/05/2021,20/07/2021,"Economics, Data Science & Big Data","[""year ""]"
https://www.mastersportal.com/studies/257226/,La Salle University,Analytics,M.Sc.,Online,1 year,772,"The M.S. in Analytics from La Salle University provides students with the background needed to delve deeper into review and questioning of data, internal and external related to their specific industry and professional needs.  ",.,English,30 alternative credits,Philadelphia,.,.,.,.,.,.,.,31/08/2021,"Business Intelligence & Analytics, Data Science & Big Data","[""credit ""]"
