platformLink,uni,title,degType,campus,duration,tuition,about,uniRank,languages,ects,city,country,toefl,ielts,gmat,gre,origLink,applyBy,startDate,disciplines,tuitiontype
https://www.mastersportal.com/studies/288761/,Ulster University London Branch,Extended MSc International Business with Data Analytics ,Pre-Master,On Campus,"1 year, 3 months",.,"The Extended MSc International Business with Data Analytics from Ulster University London Branch integrates the stand alone Graduate Certificate programme to allow entry for students with equivalent to a standard degree (third class, pass or ordinary).",.,English,240 alternative credits,London,.,.,     6      ,.,.,https://sl.prtl.co/track/click/?target=https%3A%2F%2Fqa.ulster.ac.uk%2Fcourse%2Fextended-msc-international-business-with-data-analytics%2F%3Futm_source%3Dstudyportals%26utm_medium%3Dlisting%26utm_content%3Dmsc_int_bus_data%26utm_campaign%3D20200203&facts=eyJsIjp7InQiOiJzdHVkeSIsImkiOiIyODg3NjEiLCJkIjoiRXh0ZW5kZWQgTVNjIEludGVybmF0aW9uYWwgQnVzaW5lc3Mgd2l0aCBEYXRhIEFuYWx5dGljcyIsImwiOiJwcmVtaXVtIn0sInMiOm51bGwsInUiOnsiaSI6IjE3Mi4zMC45LjIwMSIsInMiOiI1MDU1OWZhZC0xNDg2LTQzZGUtODc5OS1jZWM4NmM0OTBmNGUiLCJsIjoiZW4tR0IiLCJjIjoiZGUifSwiZiI6W3siYSI6ImNsaWMiLCJ0IjoibGluayIsImkiOiIyMTQ0Mjg4IiwiZCI6Imh0dHBzOi8vcWEudWxzdGVyLmFjLnVrL2NvdXJzZS9leHRlbmRlZC1tc2MtaW50ZXJuYXRpb25hbC1idXNpbmVzcy13aXRoLWRhdGEtYW5hbHl0aWNzLz91dG1fc291cmNlPXN0dWR5cG9ydGFscyZ1dG1fbWVkaXVtPWxpc3RpbmcmdXRtX2NvbnRlbnQ9bXNjX2ludF9idXNfZGF0YSZ1dG1fY2FtcGFpZ249MjAyMDAyMDMiLCJsIjoicmV2ZW51ZSIsImV4Ijp7InB0IjoicCJ9fV19&taps=null&duid=394ce21f-146c-46d9-b173-089b339b6b0d&sid=819ddbda-37f1-497a-aa9d-b7170bc4ac12,.,27/01/2021,"International Development, International Business, Data Science & Big Data",.
https://www.mastersportal.com/studies/290643/,University of Technology Sydney,Data Science and Innovation ,Master,On Campus,2 years,.,The Master of Data Science and Innovation at the University of Technology Sydney is a world-leading program of study in analytics and data science. ,133rd ,English,96 alternative credits,Sydney,.,     79      ,     6.5      ,.,.,https://sl.prtl.co/track/click/?target=https%3A%2F%2Fwww.uts.edu.au%2Ffuture-students%2Ffind-a-course%2Fmaster-data-science-and-innovation&facts=eyJsIjp7InQiOiJzdHVkeSIsImkiOiIyOTA2NDMiLCJkIjoiRGF0YSBTY2llbmNlIGFuZCBJbm5vdmF0aW9uIiwibCI6InByZW1pdW0ifSwicyI6bnVsbCwidSI6eyJpIjoiMTcyLjMwLjkuMjAxIiwicyI6IjUwNTU5ZmFkLTE0ODYtNDNkZS04Nzk5LWNlYzg2YzQ5MGY0ZSIsImwiOiJlbi1HQiIsImMiOiJkZSJ9LCJmIjpbeyJhIjoiY2xpYyIsInQiOiJsaW5rIiwiaSI6IjIxNDYxNzUiLCJkIjoiaHR0cHM6Ly93d3cudXRzLmVkdS5hdS9mdXR1cmUtc3R1ZGVudHMvZmluZC1hLWNvdXJzZS9tYXN0ZXItZGF0YS1zY2llbmNlLWFuZC1pbm5vdmF0aW9uIiwibCI6InJldmVudWUiLCJleCI6eyJwdCI6InAifX1dfQ%3D%3D&taps=null&duid=394ce21f-146c-46d9-b173-089b339b6b0d&sid=819ddbda-37f1-497a-aa9d-b7170bc4ac12,31/05/2021,02/08/2021,"Business Intelligence & Analytics, Innovation Management, Data Science & Big Data",.
https://www.mastersportal.com/studies/302958/,Udacity,Data Analyst ,Pre-Master,Online,4 months,"1,114","Use Python, SQL and Statistics to advance your programming skills and refine your ability to work with messy, complex datasets with the Data Analyst course at Udacity.",.,English,Online,Mountain View,.,.,.,.,.,https://sl.prtl.co/track/click/?target=https%3A%2F%2Fimp.i115008.net%2Fc%2F1303146%2F788805%2F11298%3Fprodsku%3Dnd002%26u%3Dhttps%253A%252F%252Fwww.udacity.com%252Fcourse%252Fdata-analyst-nanodegree--nd002%26intsrc%3DCATF_5678&facts=eyJsIjp7InQiOiJzdHVkeSIsImkiOiIzMDI5NTgiLCJkIjoiRGF0YSBBbmFseXN0IiwibCI6InByZW1pdW0ifSwicyI6bnVsbCwidSI6eyJpIjoiMTcyLjMwLjkuMjAxIiwicyI6IjUwNTU5ZmFkLTE0ODYtNDNkZS04Nzk5LWNlYzg2YzQ5MGY0ZSIsImwiOiJlbi1HQiIsImMiOiJkZSJ9LCJmIjpbeyJhIjoiY2xpYyIsInQiOiJsaW5rIiwiaSI6IjIxNjAwMzciLCJkIjoiaHR0cHM6Ly9pbXAuaTExNTAwOC5uZXQvYy8xMzAzMTQ2Lzc4ODgwNS8xMTI5OD9wcm9kc2t1PW5kMDAyJnU9aHR0cHMlM0ElMkYlMkZ3d3cudWRhY2l0eS5jb20lMkZjb3Vyc2UlMkZkYXRhLWFuYWx5c3QtbmFub2RlZ3JlZS0tbmQwMDImaW50c3JjPUNBVEZfNTY3OCIsImwiOiJyZXZlbnVlIiwiZXgiOnsicHQiOiJwIn19XX0%3D&taps=null&duid=394ce21f-146c-46d9-b173-089b339b6b0d&sid=819ddbda-37f1-497a-aa9d-b7170bc4ac12,.,09/12/2021,"Business Intelligence & Analytics, Data Science & Big Data","[""full ""]"
https://www.mastersportal.com/studies/266987/,UCLan Cyprus,Data Analytics ,M.Sc.,On Campus,1 year,"10,500","This Data Analytics course from UCLan Cyprus is designed to provide graduates and working professionals with knowledge and a diverse set of skills that span across all layers of the knowledge discovery stack including storage, mining, analytics, decision support frameworks and visualisations, as well as practical experience with modern tools.",.,English,90 ECTS,Larnaca,Cyprus,.,     6.5      ,.,.,https://sl.prtl.co/track/click/?target=https%3A%2F%2Fwww.uclancyprus.ac.cy%2Fpostgraduate-course%2Fmsc-data-analytics%2F&facts=eyJsIjp7InQiOiJzdHVkeSIsImkiOiIyNjY5ODciLCJkIjoiRGF0YSBBbmFseXRpY3MiLCJsIjoicHJlbWl1bSJ9LCJzIjpudWxsLCJ1Ijp7ImkiOiIxNzIuMzAuOS4yMDEiLCJzIjoiNTA1NTlmYWQtMTQ4Ni00M2RlLTg3OTktY2VjODZjNDkwZjRlIiwibCI6ImVuLUdCIiwiYyI6ImRlIn0sImYiOlt7ImEiOiJjbGljIiwidCI6ImxpbmsiLCJpIjoiMjEyMDc0OCIsImQiOiJodHRwczovL3d3dy51Y2xhbmN5cHJ1cy5hYy5jeS9wb3N0Z3JhZHVhdGUtY291cnNlL21zYy1kYXRhLWFuYWx5dGljcy8iLCJsIjoicmV2ZW51ZSIsImV4Ijp7InB0IjoicCJ9fV19&taps=null&duid=394ce21f-146c-46d9-b173-089b339b6b0d&sid=819ddbda-37f1-497a-aa9d-b7170bc4ac12,.,01/10/2021,"Data Science & Big Data, Human Computer Interaction, Artificial Intelligence","[""year""]"
https://www.mastersportal.com/studies/299455/,University of Winnipeg,Artificial Intelligence ,Postgraduate Diploma,On Campus,1 year,"9,741","Be on the cutting edge of innovation with a diploma in AI and machine learning. In this Artificial Intelligence program at University of Winnipeg, graduates master the skills to create and use problem-solving algorithms to provide insights, predictions, and operationalization strategies needed to transform any organization into an innovative, efficient, and sustainable company of the future. ",.,English,On Campus,Winnipeg,Canada,     86      ,     6.5      ,.,.,https://sl.prtl.co/track/click/?target=https%3A%2F%2Fpace.uwinnipegcourses.ca%2Finternational-students%2Fprograms%2Fartifical-intelligence-diploma%3Futm_source%3Dmastersportals.com%26utm_medium%3Dreferral%26utm_campaign%3Dprogram_listing%26utm_content%3DAID&facts=eyJsIjp7InQiOiJzdHVkeSIsImkiOiIyOTk0NTUiLCJkIjoiQXJ0aWZpY2lhbCBJbnRlbGxpZ2VuY2UiLCJsIjoicHJlbWl1bSJ9LCJzIjpudWxsLCJ1Ijp7ImkiOiIxNzIuMzAuOS4yMDEiLCJzIjoiNTA1NTlmYWQtMTQ4Ni00M2RlLTg3OTktY2VjODZjNDkwZjRlIiwibCI6ImVuLUdCIiwiYyI6ImRlIn0sImYiOlt7ImEiOiJjbGljIiwidCI6ImxpbmsiLCJpIjoiMjE1NjMxMSIsImQiOiJodHRwczovL3BhY2UudXdpbm5pcGVnY291cnNlcy5jYS9pbnRlcm5hdGlvbmFsLXN0dWRlbnRzL3Byb2dyYW1zL2FydGlmaWNhbC1pbnRlbGxpZ2VuY2UtZGlwbG9tYT91dG1fc291cmNlPW1hc3RlcnNwb3J0YWxzLmNvbSZ1dG1fbWVkaXVtPXJlZmVycmFsJnV0bV9jYW1wYWlnbj1wcm9ncmFtX2xpc3RpbmcmdXRtX2NvbnRlbnQ9QUlEIiwibCI6InJldmVudWUiLCJleCI6eyJwdCI6InAifX1dfQ%3D%3D&taps=null&duid=394ce21f-146c-46d9-b173-089b339b6b0d&sid=819ddbda-37f1-497a-aa9d-b7170bc4ac12,15/09/2021,17/01/2022,"Data Science & Big Data, Artificial Intelligence, Machine Learning","[""year ""]"
https://www.mastersportal.com/studies/303543/,Ben-Gurion University of the Negev,Software and Information Systems Engineering ,M.Sc.,On Campus,2 years,.,"The Software and Information Systems Engineering program offered by the Ben-Gurion University of the Negev is aimed at training researchers and professionals with strong analytical and practical skills in the areas of Data Mining, Data Science, Machine Learning, Deep Learning, Predictive Analytics, Big Data, and Business Intelligence. ",401st ,English,On Campus,Beersheba,Israel,     85      ,     6.5      ,.,   Required   ,https://sl.prtl.co/track/click/?target=https%3A%2F%2Finternationalatbgu.com%2Fmsc-in-software-and-information-systems-engineering%2F&facts=eyJsIjp7InQiOiJzdHVkeSIsImkiOiIzMDM1NDMiLCJkIjoiU29mdHdhcmUgYW5kIEluZm9ybWF0aW9uIFN5c3RlbXMgRW5naW5lZXJpbmciLCJsIjoicHJlbWl1bSJ9LCJzIjpudWxsLCJ1Ijp7ImkiOiIxNzIuMzAuOS4yMDEiLCJzIjoiNTA1NTlmYWQtMTQ4Ni00M2RlLTg3OTktY2VjODZjNDkwZjRlIiwibCI6ImVuLUdCIiwiYyI6ImRlIn0sImYiOlt7ImEiOiJjbGljIiwidCI6ImxpbmsiLCJpIjoiMjE2MDcwNiIsImQiOiJodHRwczovL2ludGVybmF0aW9uYWxhdGJndS5jb20vbXNjLWluLXNvZnR3YXJlLWFuZC1pbmZvcm1hdGlvbi1zeXN0ZW1zLWVuZ2luZWVyaW5nLyIsImwiOiJyZXZlbnVlIiwiZXgiOnsicHQiOiJwIn19XX0%3D&taps=null&duid=394ce21f-146c-46d9-b173-089b339b6b0d&sid=819ddbda-37f1-497a-aa9d-b7170bc4ac12,.,18/10/2021,"Data Science & Big Data, Software Engineering, Machine Learning",.
https://www.mastersportal.com/studies/123738/,EURECOM - Graduate school and Research center in Digital Science,Data Science and Engineering ,M.Sc.,On Campus,2 years,"3,000",The Master in Data Science and Engineering offered by EURECOM - Graduate School and Research Center in Digital Science aims at combining computer and statistical sciences to develop cutting-edge and fundamental tools to efficiently address data processing problems.,.,English,On Campus,Sophia Antipolis,France,     80      ,     5.5      ,.,.,https://sl.prtl.co/track/click/?target=https%3A%2F%2Fwww.eurecom.fr%2Fen%2Fteaching%2Fmasters-degrees%2Fmaster-data-science%3Futm_source%3DMasterPortal%26utm_medium%3DMaster&facts=eyJsIjp7InQiOiJzdHVkeSIsImkiOiIxMjM3MzgiLCJkIjoiRGF0YSBTY2llbmNlIGFuZCBFbmdpbmVlcmluZyIsImwiOiJwcmVtaXVtIn0sInMiOm51bGwsInUiOnsiaSI6IjE3Mi4zMC45LjIwMSIsInMiOiI1MDU1OWZhZC0xNDg2LTQzZGUtODc5OS1jZWM4NmM0OTBmNGUiLCJsIjoiZW4tR0IiLCJjIjoiZGUifSwiZiI6W3siYSI6ImNsaWMiLCJ0IjoibGluayIsImkiOiIxOTE1MzMyIiwiZCI6Imh0dHBzOi8vd3d3LmV1cmVjb20uZnIvZW4vdGVhY2hpbmcvbWFzdGVycy1kZWdyZWVzL21hc3Rlci1kYXRhLXNjaWVuY2U%2FdXRtX3NvdXJjZT1NYXN0ZXJQb3J0YWwmdXRtX21lZGl1bT1NYXN0ZXIiLCJsIjoicmV2ZW51ZSIsImV4Ijp7InB0IjoicCJ9fV19&taps=null&duid=394ce21f-146c-46d9-b173-089b339b6b0d&sid=819ddbda-37f1-497a-aa9d-b7170bc4ac12,04/06/2021,30/09/2021,"General Engineering & Technology, Data Science & Big Data, Artificial Intelligence","[""year""]"
https://www.mastersportal.com/studies/69046/,IÉSEG School of Management,Big Data Analytics for Business ,M.Sc.,On Campus,1 year,"16,900",The Master of Science in Big Data Analytics for Business program at IÉSEG School of Management is a one year program completely taught in English which aims at training data scientists.,.,English,90 ECTS,Lille,France,     85      ,     6.5      ,.,.,https://sl.prtl.co/track/click/?target=https%3A%2F%2Fstudy-at-ieseg.com%2Fprogrammes%2Fmsc-in-big-data-analytics-for-business%2F&facts=eyJsIjp7InQiOiJzdHVkeSIsImkiOiI2OTA0NiIsImQiOiJCaWcgRGF0YSBBbmFseXRpY3MgZm9yIEJ1c2luZXNzIiwibCI6InByZW1pdW0ifSwicyI6bnVsbCwidSI6eyJpIjoiMTcyLjMwLjkuMjAxIiwicyI6IjUwNTU5ZmFkLTE0ODYtNDNkZS04Nzk5LWNlYzg2YzQ5MGY0ZSIsImwiOiJlbi1HQiIsImMiOiJkZSJ9LCJmIjpbeyJhIjoiY2xpYyIsInQiOiJsaW5rIiwiaSI6IjE5ODEzNjciLCJkIjoiaHR0cHM6Ly9zdHVkeS1hdC1pZXNlZy5jb20vcHJvZ3JhbW1lcy9tc2MtaW4tYmlnLWRhdGEtYW5hbHl0aWNzLWZvci1idXNpbmVzcy8iLCJsIjoicmV2ZW51ZSIsImV4Ijp7InB0IjoicCJ9fV19&taps=null&duid=394ce21f-146c-46d9-b173-089b339b6b0d&sid=819ddbda-37f1-497a-aa9d-b7170bc4ac12,13/06/2021,01/09/2021,"Business Administration, International Business, Data Science & Big Data","[""year""]"
https://www.mastersportal.com/studies/296093/,University of Derby,Big Data Analytics (Online) ,M.Sc.,Online,3 years,"3,287","Big Data Analytics (Online) at University of Derby  gives you an in-depth knowledge and critical understanding of the key issues and concepts in today’s data-driven business and science landscapes. You will develop powerful skills in the extraction, analysis and management of information from big data using a variety of scientific techniques and software tools.",801st ,English,180 alternative credits,Buxton,.,     92      ,     6      ,.,.,https://sl.prtl.co/track/click/?target=https%3A%2F%2Fwww.derby.ac.uk%2Fonline%2Fcomputing-courses%2Fbig-data-analytics-msc-online%2F%23utm_source%3Dstudyportal%26utm_medium%3Dlisting%26utm_campaign%3Dboosted_listing_big_data_Jan2021%26utm_content%3Dboost_listing&facts=eyJsIjp7InQiOiJzdHVkeSIsImkiOiIyOTYwOTMiLCJkIjoiQmlnIERhdGEgQW5hbHl0aWNzIChPbmxpbmUpIiwibCI6InByZW1pdW0ifSwicyI6bnVsbCwidSI6eyJpIjoiMTcyLjMwLjkuMjAxIiwicyI6ImY1OWYwZjNmLWMxYTQtNDdkOS05NzE0LTRmMDVlMTM3NjY0OSIsImwiOiJlbi1HQiIsImMiOiJkZSJ9LCJmIjpbeyJhIjoiY2xpYyIsInQiOiJsaW5rIiwiaSI6IjIxNTIyMTkiLCJkIjoiaHR0cHM6Ly93d3cuZGVyYnkuYWMudWsvb25saW5lL2NvbXB1dGluZy1jb3Vyc2VzL2JpZy1kYXRhLWFuYWx5dGljcy1tc2Mtb25saW5lLyN1dG1fc291cmNlPXN0dWR5cG9ydGFsJnV0bV9tZWRpdW09bGlzdGluZyZ1dG1fY2FtcGFpZ249Ym9vc3RlZF9saXN0aW5nX2JpZ19kYXRhX0phbjIwMjEmdXRtX2NvbnRlbnQ9Ym9vc3RfbGlzdGluZyIsImwiOiJyZXZlbnVlIiwiZXgiOnsicHQiOiJwIn19XX0%3D&taps=null&duid=f163022e-3395-4880-ac8a-3e466a21a9bd&sid=4020b8af-2ac3-46c1-a9e1-e81f35ce4efa,09/05/2021,24/05/2021,"Business Intelligence & Analytics, Data Science & Big Data","[""year""]"
https://www.mastersportal.com/studies/274485/,HU University of Applied Sciences Utrecht,Data Driven Design ,M.A.,On Campus,1 year,"2,143","The Data Driven Design programme from HU University of Applied Sciences Utrecht is for those who want to understand, design and reconfigure data concepts for our continuously changing society. ",.,English,On Campus,Utrecht,Netherlands,     80      ,     6      ,.,.,https://sl.prtl.co/track/click/?target=https%3A%2F%2Fwww.internationalhu.com%2Fmaster-programmes%2Fmaster-data-driven-design&facts=eyJsIjp7InQiOiJzdHVkeSIsImkiOiIyNzQ0ODUiLCJkIjoiRGF0YSBEcml2ZW4gRGVzaWduIiwibCI6InByZW1pdW0ifSwicyI6bnVsbCwidSI6eyJpIjoiMTcyLjMwLjkuMjAxIiwicyI6ImY1OWYwZjNmLWMxYTQtNDdkOS05NzE0LTRmMDVlMTM3NjY0OSIsImwiOiJlbi1HQiIsImMiOiJkZSJ9LCJmIjpbeyJhIjoiY2xpYyIsInQiOiJsaW5rIiwiaSI6IjIxMjg5MTIiLCJkIjoiaHR0cHM6Ly93d3cuaW50ZXJuYXRpb25hbGh1LmNvbS9tYXN0ZXItcHJvZ3JhbW1lcy9tYXN0ZXItZGF0YS1kcml2ZW4tZGVzaWduIiwibCI6InJldmVudWUiLCJleCI6eyJwdCI6InAifX1dfQ%3D%3D&taps=null&duid=f163022e-3395-4880-ac8a-3e466a21a9bd&sid=4020b8af-2ac3-46c1-a9e1-e81f35ce4efa,15/07/2021,01/09/2021,"Industrial Design, Data Science & Big Data","[""year""]"
https://www.mastersportal.com/studies/172879/,Maynooth University,Data Science and Analytics ,M.Sc.,On Campus,1 year,"6,600","The MSc in Data Science and Analytics at Maynooth University is a 12 month conversion course designed to give students the knowledge and skills to collect, process analyse and visualise data in order to extract useful information, explore patterns and evaluate models. ",401st ,English,90 alternative credits,Maynooth,Ireland,     95      ,     6.5      ,.,.,https://sl.prtl.co/track/click/?target=https%3A%2F%2Fwww.maynoothuniversityinternational.com%2Fprogrammes%2Fmasters-degrees%2Fmsc-data-science-and-analytics%2F&facts=eyJsIjp7InQiOiJzdHVkeSIsImkiOiIxNzI4NzkiLCJkIjoiRGF0YSBTY2llbmNlIGFuZCBBbmFseXRpY3MiLCJsIjoicHJlbWl1bSJ9LCJzIjpudWxsLCJ1Ijp7ImkiOiIxNzIuMzAuOS4yMDEiLCJzIjoiZjU5ZjBmM2YtYzFhNC00N2Q5LTk3MTQtNGYwNWUxMzc2NjQ5IiwibCI6ImVuLUdCIiwiYyI6ImRlIn0sImYiOlt7ImEiOiJjbGljIiwidCI6ImxpbmsiLCJpIjoiMjAxNjI1OSIsImQiOiJodHRwczovL3d3dy5tYXlub290aHVuaXZlcnNpdHlpbnRlcm5hdGlvbmFsLmNvbS9wcm9ncmFtbWVzL21hc3RlcnMtZGVncmVlcy9tc2MtZGF0YS1zY2llbmNlLWFuZC1hbmFseXRpY3MvIiwibCI6InJldmVudWUiLCJleCI6eyJwdCI6InAifX1dfQ%3D%3D&taps=null&duid=f163022e-3395-4880-ac8a-3e466a21a9bd&sid=4020b8af-2ac3-46c1-a9e1-e81f35ce4efa,30/06/2021,23/09/2021,"Business Intelligence & Analytics, Data Science & Big Data","[""year""]"
https://www.mastersportal.com/studies/280403/,UCD Michael Smurfit Graduate Business School,Digital Marketing ,M.Sc.,On Campus,1 year,.,This full-time Digital Marketing course at UCD Michael Smurfit Graduate Business School is aimed at graduates who wish to develop a deep understanding and high level of competence in the application of digital marketing tools and techniques.,.,English,90 alternative credits,Dublin,Ireland,     100      ,     7      ,.,.,https://sl.prtl.co/track/click/?target=https%3A%2F%2Fwww.smurfitschool.ie%2Fprogrammes%2Fmasters%2Fmscindigitalmarketing%2F%3Futm_campaign%3DMastersportal%2B2021%26utm_source%3Dint_partnership%26utm_content%3DDM&facts=eyJsIjp7InQiOiJzdHVkeSIsImkiOiIyODA0MDMiLCJkIjoiRGlnaXRhbCBNYXJrZXRpbmciLCJsIjoicHJlbWl1bSJ9LCJzIjpudWxsLCJ1Ijp7ImkiOiIxNzIuMzAuOS4yMDEiLCJzIjoiZjU5ZjBmM2YtYzFhNC00N2Q5LTk3MTQtNGYwNWUxMzc2NjQ5IiwibCI6ImVuLUdCIiwiYyI6ImRlIn0sImYiOlt7ImEiOiJjbGljIiwidCI6ImxpbmsiLCJpIjoiMjEzNTU1NyIsImQiOiJodHRwczovL3d3dy5zbXVyZml0c2Nob29sLmllL3Byb2dyYW1tZXMvbWFzdGVycy9tc2NpbmRpZ2l0YWxtYXJrZXRpbmcvP3V0bV9jYW1wYWlnbj1NYXN0ZXJzcG9ydGFsKzIwMjEmdXRtX3NvdXJjZT1pbnRfcGFydG5lcnNoaXAmdXRtX2NvbnRlbnQ9RE0iLCJsIjoicmV2ZW51ZSIsImV4Ijp7InB0IjoicCJ9fV19&taps=null&duid=f163022e-3395-4880-ac8a-3e466a21a9bd&sid=4020b8af-2ac3-46c1-a9e1-e81f35ce4efa,.,08/09/2021,"Marketing, Data Science & Big Data, Digital Marketing",.
https://www.mastersportal.com/studies/276028/,Coursera,Spatial Data Analysis and Visualization MasterTrack ,Pre-Master,Online,½ year,"2,464","Industry areas that rely on spatial data analysis, remote sensing, cartography, and data visualization are growing at accelerated rates. With this Spatial Data Analysis and Visualization MasterTrack programme offered by Coursera in partnership with UC Davis, you’ll study at the graduate level to gain the Python programming language and GIS skills you need to advance your career.",.,English,Online,Mountain View,.,.,.,.,.,https://sl.prtl.co/track/click/?target=https%3A%2F%2Fclick.linksynergy.com%2Fdeeplink%3Fid%3DeI8rZF94Xrg%26mid%3D40328%26murl%3Dhttps%253A%252F%252Fwww.coursera.org%252Fmastertrack%252Fspatial-data-analysis-visualization-ucdavis&facts=eyJsIjp7InQiOiJzdHVkeSIsImkiOiIyNzYwMjgiLCJkIjoiU3BhdGlhbCBEYXRhIEFuYWx5c2lzIGFuZCBWaXN1YWxpemF0aW9uIE1hc3RlclRyYWNrIiwibCI6InByZW1pdW0ifSwicyI6bnVsbCwidSI6eyJpIjoiMTcyLjMwLjkuMjAxIiwicyI6ImY1OWYwZjNmLWMxYTQtNDdkOS05NzE0LTRmMDVlMTM3NjY0OSIsImwiOiJlbi1HQiIsImMiOiJkZSJ9LCJmIjpbeyJhIjoiY2xpYyIsInQiOiJsaW5rIiwiaSI6IjIxMzA3NTgiLCJkIjoiaHR0cHM6Ly9jbGljay5saW5rc3luZXJneS5jb20vZGVlcGxpbms%2FaWQ9ZUk4clpGOTRYcmcmbWlkPTQwMzI4Jm11cmw9aHR0cHMlM0ElMkYlMkZ3d3cuY291cnNlcmEub3JnJTJGbWFzdGVydHJhY2slMkZzcGF0aWFsLWRhdGEtYW5hbHlzaXMtdmlzdWFsaXphdGlvbi11Y2RhdmlzIiwibCI6InJldmVudWUiLCJleCI6eyJwdCI6InAifX1dfQ%3D%3D&taps=null&duid=f163022e-3395-4880-ac8a-3e466a21a9bd&sid=4020b8af-2ac3-46c1-a9e1-e81f35ce4efa,.,.,"Business Intelligence & Analytics, Data Science & Big Data","[""full ""]"
https://www.mastersportal.com/studies/101142/,Georgia Institute of Technology,Computer Science ,M.Sc.,Online,3 years,148,"The Computer Science program from Georgia Institute of Technology (Georgia Tech) comprises a curriculum of courses taught by the world-class faculty in the Georgia Tech College of Computing, ranked the country's No. 9 graduate CS department by U.S. News & World Report. ",38th ,English,30 alternative credits,Atlanta,.,     90      ,     7      ,.,   Required   ,https://sl.prtl.co/track/click/?target=https%3A%2F%2Fomscs.gatech.edu%2Flearn-more-oms-cs&facts=eyJsIjp7InQiOiJzdHVkeSIsImkiOiIxMDExNDIiLCJkIjoiQ29tcHV0ZXIgU2NpZW5jZSIsImwiOiJwcmVtaXVtIn0sInMiOm51bGwsInUiOnsiaSI6IjE3Mi4zMC45LjIwMSIsInMiOiJmNTlmMGYzZi1jMWE0LTQ3ZDktOTcxNC00ZjA1ZTEzNzY2NDkiLCJsIjoiZW4tR0IiLCJjIjoiZGUifSwiZiI6W3siYSI6ImNsaWMiLCJ0IjoibGluayIsImkiOiIxOTM5NTM4IiwiZCI6Imh0dHBzOi8vb21zY3MuZ2F0ZWNoLmVkdS9sZWFybi1tb3JlLW9tcy1jcyIsImwiOiJyZXZlbnVlIiwiZXgiOnsicHQiOiJwIn19XX0%3D&taps=null&duid=f163022e-3395-4880-ac8a-3e466a21a9bd&sid=4020b8af-2ac3-46c1-a9e1-e81f35ce4efa,01/03/2021,02/09/2021,"Informatics & Information Sciences, Computer Sciences, Data Science & Big Data","[""credit ""]"
https://www.mastersportal.com/studies/286491/,Humber College,Web Development ,Postgraduate Certificate,On Campus,1½ years,"3,092","The Web Development certificate at Humber College focuses on the development of websites and web services for multiple environments including database-driven programming, content management and mobile services. A combination of conceptual and practical training will prepare you to execute effective, efficient website design.",.,English,On Campus,Toronto,Canada,     88      ,     6.5      ,.,.,https://sl.prtl.co/track/click/?target=https%3A%2F%2Fwww.humbercollege-international.com%2Fprograms%2Fpostgraduate-certificate%2Fgraduate-cert-in-web-development%2F&facts=eyJsIjp7InQiOiJzdHVkeSIsImkiOiIyODY0OTEiLCJkIjoiV2ViIERldmVsb3BtZW50IiwibCI6InByZW1pdW0ifSwicyI6bnVsbCwidSI6eyJpIjoiMTcyLjMwLjkuMjAxIiwicyI6ImY1OWYwZjNmLWMxYTQtNDdkOS05NzE0LTRmMDVlMTM3NjY0OSIsImwiOiJlbi1HQiIsImMiOiJkZSJ9LCJmIjpbeyJhIjoiY2xpYyIsInQiOiJsaW5rIiwiaSI6IjIxNDE5NTUiLCJkIjoiaHR0cHM6Ly93d3cuaHVtYmVyY29sbGVnZS1pbnRlcm5hdGlvbmFsLmNvbS9wcm9ncmFtcy9wb3N0Z3JhZHVhdGUtY2VydGlmaWNhdGUvZ3JhZHVhdGUtY2VydC1pbi13ZWItZGV2ZWxvcG1lbnQvIiwibCI6InJldmVudWUiLCJleCI6eyJwdCI6InAifX1dfQ%3D%3D&taps=null&duid=f163022e-3395-4880-ac8a-3e466a21a9bd&sid=4020b8af-2ac3-46c1-a9e1-e81f35ce4efa,01/02/2021,07/09/2021,"Computer Sciences, Data Science & Big Data, Web Technologies & Cloud Computing","[""year ""]"
https://www.mastersportal.com/studies/176592/,edX - online learning platform,Software Testing and Verification MicroMasters Program ,Pre-Master,Online,½ year,614,EdX is an online learning platform trusted by over 12 million users offering the Software Testing and Verification MicroMasters Program in collaboration with University System of Maryland - USMx and UMUC. Learn methods and techniques to test and verify software to advance your career as a software tester or software developer.,.,English,12 alternative credits,Adelphi,.,.,.,.,.,https://sl.prtl.co/track/click/?target=https%3A%2F%2Fwww.awin1.com%2Fcread.php%3Fawinmid%3D6798%26awinaffid%3D203405%26clickref%3DPM%26ued%3Dhttps%253A%252F%252Fwww.edx.org%252Fmicromasters%252Fusmx-umgc-software-testing-and-verification&facts=eyJsIjp7InQiOiJzdHVkeSIsImkiOiIxNzY1OTIiLCJkIjoiU29mdHdhcmUgVGVzdGluZyBhbmQgVmVyaWZpY2F0aW9uIE1pY3JvTWFzdGVycyBQcm9ncmFtIiwibCI6InByZW1pdW0ifSwicyI6bnVsbCwidSI6eyJpIjoiMTcyLjMwLjkuMjAxIiwicyI6ImY1OWYwZjNmLWMxYTQtNDdkOS05NzE0LTRmMDVlMTM3NjY0OSIsImwiOiJlbi1HQiIsImMiOiJkZSJ9LCJmIjpbeyJhIjoiY2xpYyIsInQiOiJsaW5rIiwiaSI6IjIwMjAyNDkiLCJkIjoiaHR0cHM6Ly93d3cuYXdpbjEuY29tL2NyZWFkLnBocD9hd2lubWlkPTY3OTgmYXdpbmFmZmlkPTIwMzQwNSZjbGlja3JlZj1QTSZ1ZWQ9aHR0cHMlM0ElMkYlMkZ3d3cuZWR4Lm9yZyUyRm1pY3JvbWFzdGVycyUyRnVzbXgtdW1nYy1zb2Z0d2FyZS10ZXN0aW5nLWFuZC12ZXJpZmljYXRpb24iLCJsIjoicmV2ZW51ZSIsImV4Ijp7InB0IjoicCJ9fV19&taps=null&duid=f163022e-3395-4880-ac8a-3e466a21a9bd&sid=4020b8af-2ac3-46c1-a9e1-e81f35ce4efa,.,.,"Informatics & Information Sciences, Computer Sciences, Data Science & Big Data","[""full ""]"
https://www.mastersportal.com/studies/302580/,West University of Timisoara,"Big Data - Data science, Analytics and Technologies ",Master,On Campus,2 years,270,"The aim of the Big Data - Data science, Analytics and Technologies program from West University of Timisoara is to provide knowledge on the design of efficient and robust, models for statistical analysis of data, skills in designing, implementing and using data mining algorithms, skills in using technologies for big data processing and in implementing scalable applications. ",1001st ,English,On Campus,Timisoara,Romania,.,.,.,.,https://sl.prtl.co/track/click/?target=https%3A%2F%2Fri.uvt.ro%2Fstudy-programmes-in-foreign-languages%2F%3Flang%3Den&facts=eyJsIjp7InQiOiJzdHVkeSIsImkiOiIzMDI1ODAiLCJkIjoiQmlnIERhdGEgLSBEYXRhIHNjaWVuY2UsIEFuYWx5dGljcyBhbmQgVGVjaG5vbG9naWVzIiwibCI6InByZW1pdW0ifSwicyI6bnVsbCwidSI6eyJpIjoiMTcyLjMwLjkuMjAxIiwicyI6ImY1OWYwZjNmLWMxYTQtNDdkOS05NzE0LTRmMDVlMTM3NjY0OSIsImwiOiJlbi1HQiIsImMiOiJkZSJ9LCJmIjpbeyJhIjoiY2xpYyIsInQiOiJsaW5rIiwiaSI6IjIxNTk1ODEiLCJkIjoiaHR0cHM6Ly9yaS51dnQucm8vc3R1ZHktcHJvZ3JhbW1lcy1pbi1mb3JlaWduLWxhbmd1YWdlcy8%2FbGFuZz1lbiIsImwiOiJyZXZlbnVlIiwiZXgiOnsicHQiOiJwIn19XX0%3D&taps=null&duid=f163022e-3395-4880-ac8a-3e466a21a9bd&sid=4020b8af-2ac3-46c1-a9e1-e81f35ce4efa,31/07/2021,01/10/2021,"Computer Sciences, Data Science & Big Data, Web Technologies & Cloud Computing","[""module""]"
https://www.mastersportal.com/studies/247577/,Coursera,Computer Science (Featuring Data Science Track) ,Master,Online,1 year,"17,611","The Master of Computer Science (Featuring Data Science Track) offered by Coursera in partnership with University of Illinois is designed to be flexible and fast — you can earn your Master’s with 100% online courses in as little as 12 months, while applying your learning immediately to your job.",.,English,32 alternative credits,Mountain View,.,.,.,.,.,https://sl.prtl.co/track/click/?target=https%3A%2F%2Fclick.linksynergy.com%2Fdeeplink%3Fid%3DeI8rZF94Xrg%26mid%3D40328%26murl%3Dhttps%253A%252F%252Fwww.coursera.org%252Fdegrees%252Fmaster-of-computer-science-illinois&facts=eyJsIjp7InQiOiJzdHVkeSIsImkiOiIyNDc1NzciLCJkIjoiQ29tcHV0ZXIgU2NpZW5jZSAoRmVhdHVyaW5nIERhdGEgU2NpZW5jZSBUcmFjaykiLCJsIjoicHJlbWl1bSJ9LCJzIjpudWxsLCJ1Ijp7ImkiOiIxNzIuMzAuOS4yMDEiLCJzIjoiZjU5ZjBmM2YtYzFhNC00N2Q5LTk3MTQtNGYwNWUxMzc2NjQ5IiwibCI6ImVuLUdCIiwiYyI6ImRlIn0sImYiOlt7ImEiOiJjbGljIiwidCI6ImxpbmsiLCJpIjoiMjEwMDI4OSIsImQiOiJodHRwczovL2NsaWNrLmxpbmtzeW5lcmd5LmNvbS9kZWVwbGluaz9pZD1lSThyWkY5NFhyZyZtaWQ9NDAzMjgmbXVybD1odHRwcyUzQSUyRiUyRnd3dy5jb3Vyc2VyYS5vcmclMkZkZWdyZWVzJTJGbWFzdGVyLW9mLWNvbXB1dGVyLXNjaWVuY2UtaWxsaW5vaXMiLCJsIjoicmV2ZW51ZSIsImV4Ijp7InB0IjoicCJ9fV19&taps=null&duid=f163022e-3395-4880-ac8a-3e466a21a9bd&sid=4020b8af-2ac3-46c1-a9e1-e81f35ce4efa,.,.,"Computer Sciences, Data Science & Big Data, IT Security","[""year ""]"
